{
  "schema_version": 1,
  "task_id": "T-045",
  "lease_generation": 1,
  "verdict": "PASS",
  "base_commit": "c35c72ffdd468e28fec7be9b472c623c0e77c2ae",
  "head_commit": "3f6b012b1e67d1f0edb38c0e4b81c9384eed794e",
  "runner_commit": "3f9f58f803a98e0a3f1ff10a6d3d3d720baf1f38",
  "runner_machine": "A",
  "runner_environment_checked_at": "2026-08-16T09:37:01Z",
  "started_at": "2026-08-16T09:37:38Z",
  "finished_at": "2026-08-16T09:37:38Z",
  "checks": [
    {
      "name": "range-validation",
      "command": "py -3 scripts/workflow.py validate --base c35c72ffdd468e28fec7be9b472c623c0e77c2ae --head 3f6b012b1e67d1f0edb38c0e4b81c9384eed794e",
      "exit_code": 0
    },
    {
      "name": "unit-tests",
      "command": "py -3 -m unittest discover -s tests",
      "exit_code": 0
    }
  ],
  "evidence": [
    {
      "name": "设定来源可追溯",
      "result": "PASS",
      "detail": "17国执政党映射依 02卷四节各国政治力量清单 + 七节归属总表 + 10卷八·一人物表 + 协作/政治光谱/坐标-国家政党.json（56条），D-20260816-002 定案；四极按 D-20260812-057 判据（坐标表引擎极与文件 ruling_party 一致）"
    },
    {
      "name": "写入路径符合权限",
      "result": "PASS",
      "detail": "交付 19 文件均 ∈ T-045 outputs（mod/history/countries/ 17 + 决策记录 D-20260816-002.json/.md），handoff scope 强制校验通过（D-20260811-021）；本体未触碰"
    },
    {
      "name": "内容生成自检断言",
      "result": "PASS",
      "detail": "生成脚本逐文件断言：无 BOM、无 CRLF、ruling_party 仅四极、文本含 TXG_set_project_party、7 个 TXG_axis_* 变量、USA capital=371（361->CAN 归属）、MEX 占位注释不初始化项目状态（D-20260812-053 fail-closed）"
    },
    {
      "name": "契约一致性",
      "result": "PASS",
      "detail": "内联块 7 变量+8大旗标+set_politics 对齐 mod/common/scripted_effects/00_txg_government_scripted_effects.txt 注释模板（D-20260815-004 无参化）与 docs/意识形态-跨极映射表.md 三节旗标（liberal_imperialism->TXG_gov_imperialist，D-20260812-051）"
    },
    {
      "name": "待定项门禁",
      "result": "PASS",
      "detail": "MEX 执政党中央集权主义=02卷七节待定（无对应 40 子类型），ruling_party=neutrality 四极 generic + 占位注释；on_startup fail-closed 标记 TXG_party_state_missing 不崩"
    },
    {
      "name": "租约与交接匹配",
      "result": "PASS",
      "detail": "generation=1、分支 task/T-045-g1 tip=3f6b012b、base=c35c72f、decision_ids 4项（D-20260812-025/058/065、D-20260813-002）+ 执行期 D-20260816-002；handoff state_commit=3a7125f"
    }
  ],
  "git_dirty": false,
  "registrable": true,
  "consumed_by": {
    "task_id": "T-045",
    "generation": 1,
    "result": "pass",
    "consumed_at": "2026-08-16T09:37:42Z"
  }
}
