{
  "schema_version": 1,
  "task_id": "T-048",
  "lease_generation": 1,
  "verdict": "PASS",
  "base_commit": "cabcd2eb004b70171ad13d002c9b44a7fa2b68b9",
  "head_commit": "8a216131b5e78f0057f207b960030a5490e7ba45",
  "runner_commit": "36f6ec9118c7a25640a79d5516dbf1d375c21be3",
  "runner_machine": "A",
  "runner_environment_checked_at": "2026-08-16T02:06:20Z",
  "started_at": "2026-08-16T02:15:00Z",
  "finished_at": "2026-08-16T02:20:00Z",
  "checks": [
    {
      "name": "range-validation",
      "command": "py -3 scripts/workflow.py validate --base cabcd2eb004b70171ad13d002c9b44a7fa2b68b9 --head 8a216131b5e78f0057f207b960030a5490e7ba45",
      "exit_code": 0
    },
    {
      "name": "unit-tests",
      "command": "py -3 -m unittest discover -s tests",
      "exit_code": 0
    },
    {
      "name": "mod-activation-verification",
      "command": "py -3 scripts/workflow.py game-test --task T-028 --profile map-load（机器A实机）",
      "exit_code": 0
    }
  ],
  "evidence": [
    {
      "name": "设定来源可追溯",
      "result": "PASS",
      "detail": "Gate 0 基线（协作/审查记录/加载测试-Gate0基线-2026-08-14.md）13 次实机+崩溃转储归因；mod 激活机制（dlc_load 无 BOM + pdx 注册）基线 §6b"
    },
    {
      "name": "写入路径符合权限",
      "result": "PASS",
      "detail": "交付 9 文件均 ∈ T-048 outputs（scripts/schemas/config/决策记录）；handoff schema v2 scope 校验通过；本体未触碰"
    },
    {
      "name": "设定层改动同步",
      "result": "PASS",
      "detail": "本任务不涉及 Settings/设定书（决策记录 D-20260815-001~005 登记实现批次）"
    },
    {
      "name": "待定项门禁",
      "result": "PASS",
      "detail": "T-048 任务书 pending 条目（真实基线）已由机器 A 证据解决（加载测试-Gate0基线）"
    },
    {
      "name": "租约与交接匹配",
      "result": "PASS",
      "detail": "generation=1、分支 task/T-048-g1 tip=8a21613、base=cabcd2e；handoff state_commit=36f6ec9"
    },
    {
      "name": "实机验收证据",
      "result": "PASS",
      "detail": "T-028 map-load 多轮 PASS（端到端 pending_test→test-result 防重放完成）；基线报告含 FAIL/INCONCLUSIVE 归因路径"
    }
  ],
  "git_dirty": false,
  "registrable": true,
  "consumed_by": {
    "task_id": "T-048",
    "generation": 1,
    "result": "pass",
    "consumed_at": "2026-08-16T02:19:16Z"
  }
}
